[
  {
    "id": "human",
    "name": "Humano",
    "description": "Equilibrados em todos os aspectos. Bem aceitos em Vocans e na sociedade de Hominum.",
    "stat_modifiers": { "str": 0, "dex": 0, "con": 0, "int": 0, "wis": 0, "cha": 0 },
    "flexible_points": 2,
    "derived_bonuses": { "hp_bonus": 0, "mana_bonus": 0, "initial_affinity_bonus": 0 },
    "narrative_effects": [],
    "lore": "Os humanos de Hominum formam a base da academia de Vocans. Sem aptidões especiais, compensam com adaptabilidade e determinação."
  },
  {
    "id": "elf",
    "name": "Elfo",
    "description": "Alta afinidade mágica e conexão inata com o Éter. Arrogantes por natureza, mas bem vistos em Vocans.",
    "stat_modifiers": { "str": -1, "dex": 0, "con": 0, "int": 2, "wis": 1, "cha": 0 },
    "flexible_points": 0,
    "derived_bonuses": { "hp_bonus": 0, "mana_bonus": 10, "initial_affinity_bonus": 0 },
    "narrative_effects": [
      { "type": "dialogue_variant", "value": "elven_arrogance" }
    ],
    "lore": "Os elfos possuem conexão inata com o Éter. Sua presença em Vocans é rara, mas sempre marcante. Raramente admitem fraqueza — o que pode ser fatal no Éter."
  },
  {
    "id": "dwarf",
    "name": "Anão",
    "description": "Resistência física superior. Menor aptidão mágica. Poucos se tornam invocadores, mas os que chegam a Vocans raramente recuam.",
    "stat_modifiers": { "str": 1, "dex": 0, "con": 2, "int": -1, "wis": 0, "cha": 0 },
    "flexible_points": 0,
    "derived_bonuses": { "hp_bonus": 20, "mana_bonus": -10, "initial_affinity_bonus": 0 },
    "narrative_effects": [],
    "lore": "Anões raramente se tornam invocadores, mas os poucos que chegam a Vocans tendem a sobreviver onde outros falham. Sua teimosia é, muitas vezes, uma virtude."
  },
  {
    "id": "orc",
    "name": "Orc",
    "description": "Modo difícil. Força e resistência máximas, mas perseguição constante em Hominum. Cada passo em Vocans é uma batalha além do combate.",
    "stat_modifiers": { "str": 3, "dex": 0, "con": 2, "int": 0, "wis": 0, "cha": -2 },
    "flexible_points": 0,
    "derived_bonuses": { "hp_bonus": 25, "mana_bonus": 0, "initial_affinity_bonus": 0 },
    "narrative_effects": [
      { "type": "price_markup", "value": 30 },
      { "type": "social_persecution", "value": true },
      { "type": "mission_locked", "value": ["noble_quests", "political_missions"] }
    ],
    "lore": "Um orc em Vocans é uma visão rara e perturbadora para muitos. Preconceito, preços inflados e desconfiança são companheiros constantes. Mas o respeito conquistado — esse ninguém tira."
  }
]
